Name,Type,Classification,Res_Inf,Prerequisites,Subtitle,Quantity,Source,Rules Text,Flavour Text,Notes,Aliases
Super-Dreadnought I,<:L1Z1XFL4G:799976965813698600> L1Z1X Dreadnought,Ship,,<:TechPropulsion:786336467832012821><:TechPropulsion:786336467832012821><:TechCybernetic:786336610014724127>,,,Twilight Imperium 83,"**Cost: 4, Combat: 5, Move: 1, Capacity: 2**|SUSTAIN DAMAGE, BOMBARDMENT 5",,,"superdreadnought 1, superdreadnought, superdreadnought i, super dreadnought, super dreadnought i, super dreadnought 1, sdn"
Super-Dreadnought II,<:L1Z1XFL4G:799976965813698600> L1Z1X Dreadnought,Ship,,,,,Twilight Imperium 84,"**Cost: 4, Combat: 4, Move: 2, Capacity: 2**|This unit cannot be destroyed by ""Direct Hit"" action cards.|SUSTAIN DAMAGE, BOMBARDMENT 4",,,"superdreadnought 2, superdreadnought ii, super dreadnought ii, super dreadnought 2, sdn2"
The Alastor,<:NekroFlag:799977517473464340> Nekro Flagship,Flagship,,,,,Twilight Imperium 85,"**Cost: 8, Combat: 9 (x2), Move: 1, Capacity: 3**|At the start of a space combat, choose any number of your ground forces in this system to participate in that combat as if they were ships.| SUSTAIN DAMAGE",,,"nekro flagship, virus flagship, nekro flag, virus flag"
The Inferno,<:MuaatFlag:799977247501975619> Muaat Flagship,Flagship,,,,,Twilight Imperium 86,"**Cost: 8, Combat: 5 (x2), Move: 1, Capacity: 3**|ACTION: Spend 1 token from your strategy pool to place 1 cruiser in this unit's system.| SUSTAIN DAMAGE",,,"muaat flagship, embers flagship, muaat flag, embers flag"
The Terror Between,<:KebabFlag:799976538744291339> Vuil'raith Flagship,Flagship,,,,,Prophecy of Kings,"**Cost: 8, Combat: 5 (x2), Move: 1, Capacity: 3**|Capture all other non-structure units that are destroyed in this system, including your own.| SUSTAIN DAMAGE, BOMBADMENT 5",,,"cabal flagship, cabal flag, vuilraith flagship, vuilraith flag"
Valkyrie Exoskeleton,<:SardakkNorrPizzaBoyFlag:799977732058382336> N'orr Mech,Ground Force,,,,,Prophecy of Kings,"**Cost: 2, Combat: 6**|After this unit uses its SUSTAIN DAMAGE ability during ground combat, it produces 1 hit against your opponent's ground forces on this planet.|SUSTAIN DAMAGE",,,"sardakk mech, n'orr mech, norr mech"
Van Hauge,<:YinFlag:799978188410322967> Yin Flagship,Flagship,,,,,Prophecy of Kings,"**Cost: 8, Combat: 9 (x2), Move: 1, Capacity: 3**|When this ship is destroyed, destroy all ships in this system.| SUSTAIN DAMAGE",,,"yin flagship, yin flag"
Visz El Vir,<:NaazRokhaNRAFlag:799977386720231434> Naaz-Rokha Flagship,Flagship,,,,,Twilight Imperium 90,"**Cost: 8, Combat: 9 (x2), Move: 1, Capacity: 4**|Your mechs in this system roll 1 additional die during combat.| SUSTAIN DAMAGE",,,"nra flagship, nra flag, naaz-rokha flagship, naaz-rokha flag, naaz rokha flagship, naaz rokha flag"
War Sun,War Sun,Ship,,<:TechCybernetic:786336610014724127><:TechWarfare:786336653085376558><:TechWarfare:786336653085376558><:TechWarfare:786336653085376558>,,,Twilight Imperium 91,"**Cost: 12, Combat: 3 (x3), Move: 2, Capacity: 6**|Other player's units in this system lose PLANETARY SHIELD.|SUSTAIN DAMAGE, BOMBARDMENT 3 (x3)",,,warsun
Watcher,<:EmpyreanFlag:799976612216176661> Empyrean Mech,Ground Force,,,,,Prophecy of Kings,"**Cost: 2, Combat: 6**|You may remove this unit from a system that contains or is adjacent to another player's units to cancel an action card played by that player.|SUSTAIN DAMAGE",,,empyrean mech
Wrath of Kenara,<:HacanFlag:799976797784768513> Hacan Flagship,Flagship,,,,,Twilight Imperium 93,"**Cost: 8, Combat :7 (x2), Move: 1, Capacity: 3**|After you roll a die during a space combat in this system, you may spend 1 trade good to apply +1 to the result.| SUSTAIN DAMAGE",,,"hacan flagship, cat flagship, hacan flag, cat flag"
Y'sia Y'ssrila,<:YssarilFlag:799978263409459200> Yssaril Flagship,Flagship,,,,,Twilight Imperium 94,"**Cost: 8, Combat: 5 (x2), Move: 2, Capacity: 3**|This ship can move through systems that contain other players' ships.| SUSTAIN DAMAGE",,,"yssaril flagship, tribes flagship, goblin flagship, yssaril flag, tribes flag, goblin flag"
ZS Thunderbolt M2,<:SolFlag:799977825205616661> Sol Mech,Ground Force,,,,,Prophecy of Kings,"**Cost: 2, Combat: 6**|DEPLOY: After you use your ORBITAL DROP faction ability, you may spend 3 resources to place 1 mech on that planet.|SUSTAIN DAMAGE",,,sol mech
